{
  "schema_version": "1.0.0",
  "product_version": "1.0.0-rc.1",
  "pack_id": null,
  "revision": 0,
  "exported_at": null,
  "active_opportunity_id": null,
  "privacy": null,
  "files": [
    {
      "path": "career-profile.json",
      "schema": "career-profile",
      "sha256": null
    },
    {
      "path": "preferences.json",
      "schema": "preferences",
      "sha256": null
    },
    {
      "path": "story-bank.json",
      "schema": "story-bank",
      "sha256": null
    }
  ]
}
